style,colors,size,category,short_description,long_description,stringified_description,worn_image,basicimg,sale_status
ZV228,Orange;Yellow,3XL;4XL;5XL;7XL;L;M;S;XL;XS;XXS;2XL,streetworx;unisex;industrial;polos-vests;outerwear,Unisex Hi Vis Waterproof Reversible Vest,"{'sizes': 'XXS - 5XL, 7XL', 'fabric': ['Outer: 100% 300D Oxford Polyester, 70 GSM; Vest Lining: Brushed Polar Fleece, 340 GSM'], 'features': ['Waterproof and seam sealed', ' Vest can zip into ZJ220 Mens Hi Vis Basic 4 in 1 Waterproof Jacket', ' Waterproof rating 3,000mm', ' Warm polar fleece lining', ' 2 Waist pockets on the inside and outside', ' Embroidery access']}","Sizes: XXS - 5XL, 7XL; Fabric: Outer: 100% 300D Oxford Polyester, 70 GSM; Vest Lining: Brushed Polar Fleece, 340 GSM; Features: Waterproof and seam sealed, Vest can zip into ZJ220 Mens Hi Vis Basic 4 in 1 Waterproof Jacket, Waterproof rating 3,000mm, Warm polar fleece lining, 2 Waist pockets on the inside and outside, Embroidery access; ",ZV228_Talent_Orange_01_mPCYvoQ.jpg,ZV228_Talent_Orange_01_mPCYvoQ.jpg;ZV228_Product_Orange_01_sfgTx3j.jpg;ZV228_Product_Orange_02_mq2IULC.jpg;ZV228_Product_Orange_03_6HBaeM2.jpg;ZV228_Product_Orange_04_sIhCUGG.jpg;ZV228_Talent_Yellow_01_lsZrTnv.jpg;ZV228_Talent_Yellow_02_s3uPndQ.jpg;ZV228_Product_Yellow_02.jpg;ZV228_Product_Yellow_03.jpg;ZV228_Product_Yellow_04.jpg;ZV228_Product_Yellow_01.jpg,normal
ZV245,Navy;Black,2XL;3XL;4XL;5XL;7XL;L;M;S;XS;XXS;XL,industrial;outerwear;industrial-workwear;vests;jackets,Unisex Streetworx Hooded Puffer Vest,"{'sizes': 'XXS - 5XL, 7XL', 'fabric': '100% Polyester Ripstop', 'features': ['Strong ripstop shell for increased durability', 'Mechanical stretch to increase freedom of movement', 'Water resistant fabric', 'Removable zip off hood to keep you warm and protected', 'Warm blown polyester fill gives 3D look', 'Elasticated arm hole', '2 Large front hip pockets with zip closure to store all your items securely', 'Large embroidery zip access']}","Sizes: XXS - 5XL, 7XL; Fabric: 100% Polyester Ripstop; Features: Strong ripstop shell for increased durability,Mechanical stretch to increase freedom of movement,Water resistant fabric,Removable zip off hood to keep you warm and protected,Warm blown polyester fill gives 3D look,Elasticated arm hole,2 Large front hip pockets with zip closure to store all your items securely,Large embroidery zip access; ",ZV245_Talent_Navy_08.jpg,ZV245_Talent_Navy_08.jpg;ZV245_Talent_Navy_01_1rqFzF7.jpg;ZV245_Talent_Navy_03.jpg;ZV245_Talent_Navy_05.jpg;ZV245_Talent_Navy_06.jpg;ZV245_Product_Navy_01.jpg;ZV245_Product_Navy_02.jpg;ZV245_Product_Navy_03.jpg;ZV245_Talent_Black_01.jpg;ZV245_Talent_Black_02.jpg;ZV245_Talent_Black_06.jpg;ZV245_Product_Black_01.jpg;ZV245_Product_Black_02.jpg;ZV245_Product_Black_03.jpg,new style
ZV358,Yellow;Orange,S;M;L;XL;2XL;3XL;4XL;5XL;7XL,vests;all;hi vis taped;wet weather;syzmik essentials;polos-vests;wet-weather;male;short sleeve;industrial;outerwear;industrial-workwear;engineered-outerwear,Mens Hi Vis Lightweight Waterproof Vest,"{'sizes': 'S - 5XL, 7XL', 'fabric': '100% 300D Oxford Polyester', 'features': ['Reversible with fleece inner and side pockets', 'Fully seam\xa0sealed', 'Reflective tape', 'ID chest pocket']}","Sizes: S - 5XL, 7XL; Fabric: 100% 300D Oxford Polyester; Features: Reversible with fleece inner and side pockets,Fully seamsealed,Reflective tape,ID chest pocket; ",ZV358_Product_Yellow_01.jpg,ZV358_Product_Yellow_01.jpg;ZV358_Product_Yellow_02.jpg;ZV358_Product_Orange_01.jpg;ZV358_Product_Orange_02.jpg,normal
ZV426,Orange/Navy;Yellow/Navy,XXS;XS;S;M;L;XL;2XL;3XL;4XL;5XL;7XL,hi vis taped;vests;polos-vests;industrial;outerwear;industrial-workwear;engineered-outerwear,Unisex Hi Vis Softshell Vest,"{'sizes': 'XXS - 5XL, 7XL', 'fabric': '100% Softshell with Bonded Fleece Backing - 310 gsm', 'features': ['Clear ID Pocket on Chest', 'Two covered side hip pockets to keep all of items safe', 'Longer tail for added protection from the elements']}","Sizes: XXS - 5XL, 7XL; Fabric: 100% Softshell with Bonded Fleece Backing - 310 gsm; Features: Clear ID Pocket on Chest,Two covered side hip pockets to keep all of items safe,Longer tail for added protection from the elements; ",ZV426_bProduct_Orange_Navy_02_8HlfEfI.jpg,ZV426_bProduct_Orange_Navy_02_8HlfEfI.jpg;ZV426_bProduct_Orange_Navy_01_sAiatfX.jpg;ZV426_aTalent_Yellow_Navy_01_qfBAnaP.jpg;ZV426_bProduct_Yellow_Navy_01_69ywLmq.jpg;ZV426_bProduct_Yellow_Navy_02_bxrVNKt.jpg,normal
ZV687,Orange,2XL;3XL;5XL;7XL;L;M;XS;S;XL,streetworx;unisex;industrial;polos-vests,Unisex Hi Vis VIC Rail Zip Vest,"{'sizes': 'XS - 3XL, 5XL, 7XL', 'fabric': '100% Polyester Tricot', 'features': ['Zip front fastening', ' VIC Rail tape configuration and colour', ' Perfect to keep in the car to ensure you always comply with any worksite standards']}","Sizes: XS - 3XL, 5XL, 7XL; Fabric: 100% Polyester Tricot; Features: Zip front fastening, VIC Rail tape configuration and colour, Perfect to keep in the car to ensure you always comply with any worksite standards; ",ZV687_Talent_VicRailOrange_01_n044FUh.jpg,ZV687_Talent_VicRailOrange_01_n044FUh.jpg;ZV687_Talent_VicRailOrange_02_Ex7VTYq.jpg;ZV687_Product_VicRailOrange_02.jpg;ZV687_Product_VicRailOrange_01.jpg,promotion
ZV697,Orange,2XL;3XL;5XL;7XL;L;M;S;XL;XS,streetworx;unisex;industrial;polos-vests,Unisex Hi Vis NSW Rail Vest,"{'sizes': 'XS - 3XL, 5XL, 7XL', 'fabric': '100% Polyester Tricot', 'features': ['Shoulder and side openings with quick close tape', ' Quick close tape on side hips will break open in case of vest getting caught', ' Breathable mesh panel across front and rear shoulders', ' Large pocket with quick close fastener', ' Radio loop', ' Clear ID Pocket on chest', ' Longer tail']}","Sizes: XS - 3XL, 5XL, 7XL; Fabric: 100% Polyester Tricot; Features: Shoulder and side openings with quick close tape, Quick close tape on side hips will break open in case of vest getting caught, Breathable mesh panel across front and rear shoulders, Large pocket with quick close fastener, Radio loop, Clear ID Pocket on chest, Longer tail; ",ZV697_Product_Orange_01.jpg,ZV697_Product_Orange_01.jpg;ZV697_Product_Orange_02_WweuWm6.jpg;ZV697_Talent_Orange_01_ZNfa7p9.jpg,normal
ZV998,Orange;Pink;Yellow,XS;S;M;L;XL;2XL;3XL;5XL;7XL,vests;all;hi vis taped;syzmik essentials;polos-vests;male;short sleeve;industrial;outerwear;industrial-workwear;engineered-outerwear,Unisex Hi Vis Zip Vest,"{'sizes': 'XS - 3XL, 5XL, 7XL', 'fabric': '100% Polyester', 'features': ['Zip front fastening', 'ID Chest pocket', 'Reflective tape', 'Perfect to keep in the car to ensure you always comply with any worksites standards']}","Sizes: XS - 3XL, 5XL, 7XL; Fabric: 100% Polyester; Features: Zip front fastening,ID Chest pocket,Reflective tape,Perfect to keep in the car to ensure you always comply with any worksites standards; ",ZV998_aTalent_Orange_01_G03PGwC.jpg,ZV998_aTalent_Orange_01_G03PGwC.jpg;ZV998_bProduct_Orange_01_ZjYtz9X.jpg;ZV998_bProduct_Orange_02_O1GF8pk.jpg;ZV998_Product_Pink_01.jpg;ZV998_Product_Pink_02.jpg;ZV998_bProduct_Yellow_02_MdrjeNB.jpg;ZV998_bProduct_Yellow_01_0iYlUo8.jpg,normal
ZV999,Yellow;Orange,XS;S;M;L;XL;2XL;5XL;3XL;7XL,basic;vests;all;hi vis taped;syzmik essentials;polos-vests;male;short sleeve;industrial;outerwear;industrial-workwear;engineered-outerwear,Unisex Hi Vis Basic Vest,"{'sizes': 'XS - 3XL, 5XL, 7XL', 'fabric': '100% Polyester', 'features': ['Quick release front fastening', 'Reflective tape', 'Perfect to keep in the car to ensure you always comply with any worksites standards']}","Sizes: XS - 3XL, 5XL, 7XL; Fabric: 100% Polyester; Features: Quick release front fastening,Reflective tape,Perfect to keep in the car to ensure you always comply with any worksites standards; ",ZV999_bProduct_Yellow_01_1ncIcuL.jpg,ZV999_bProduct_Yellow_01_1ncIcuL.jpg;ZV999_bProduct_Yellow_02_i562A8p.jpg;ZV999_bProduct_Orange_01_cWV7Ss4.jpg;ZV999_bProduct_Orange_02_zNMBjmP.jpg,normal
ZW001,Navy;Charcoal;Black,72;77;82;87;92;97;102;107;112;117;122;132;127,all;pants;non taped;syzmik essentials;male;industrial;mix and match;pants and shorts;industrial-workwear;work-pants-and-shorts,Mens Midweight Drill Cargo Pant (Regular),"{'sizes': '72R - 132R', 'fabric': '100% Cotton Twill - 280 gsm', 'features': ['Multi pocket cargo pant', '280 gsm mid weight pre-shrunk cotton drill to keep you cool while still being tough enough for any job', 'Inset crotch panel', 'Triple stitched seams for extra durability', 'Reinforced double layer knee, heel and pocket patches', 'Wide belt loops', 'Side welt pocket']}","Sizes: 72R - 132R; Fabric: 100% Cotton Twill - 280 gsm; Features: Multi pocket cargo pant,280 gsm mid weight pre-shrunk cotton drill to keep you cool while still being tough enough for any job,Inset crotch panel,Triple stitched seams for extra durability,Reinforced double layer knee, heel and pocket patches,Wide belt loops,Side welt pocket; ",ZW001_aTalent_Navy_01_vprSTTn.jpg,ZW001_aTalent_Navy_01_vprSTTn.jpg;ZW001_bProduct_Navy_02_339lGY7.jpg;ZW001_bProduct_Navy_01_OV70W6G.jpg;ZW001_bProduct_Charcoal_01_gqeSRyE.jpg;ZW001_bProduct_Charcoal_02_Za5WMEM.jpg;ZW001_bProduct_Black_01_Eu5m0aY.jpg;ZW001_bProduct_Black_02_NV7HJHS.jpg,normal
ZW001S,Black;Navy;Charcoal,87;92;97;102;107;112;117;122;127;132,all;pants;male;industrial;mix and match;pants and shorts;industrial-workwear;work-pants-and-shorts,Mens Midweight Drill Cargo Pant (Stout),"{'sizes': '87S -132S', 'fabric': '100% Cotton Twill - 280 gsm', 'features': ['Multi pocket cargo pant', '280 gsm mid weight pre-shrunk cotton drill to keep you cool while still being tough enough for any job', 'Inset crotch panel', 'Triple stitched seams for extra durability', 'Reinforced double layer knee, heel and pocket patches', 'Wide belt loops', 'Side welt pocket']}","Sizes: 87S -132S; Fabric: 100% Cotton Twill - 280 gsm; Features: Multi pocket cargo pant,280 gsm mid weight pre-shrunk cotton drill to keep you cool while still being tough enough for any job,Inset crotch panel,Triple stitched seams for extra durability,Reinforced double layer knee, heel and pocket patches,Wide belt loops,Side welt pocket; ",ZW001S_bProduct_Black_02_Hm4bYG4.jpg,ZW001S_bProduct_Black_02_Hm4bYG4.jpg;ZW001S_bProduct_Black_01_9SnDqla.jpg;ZW001S_aTalent_Navy_01_i7u8pWy.jpg;ZW001S_bProduct_Navy_01_sU9BKvt.jpg;ZW001S_bProduct_Navy_02_FD30e5R.jpg;ZW001S_bProduct_Charcoal_01_g7L5Q7Q.jpg;ZW001S_bProduct_Charcoal_02_7yHR7uT.jpg,normal
ZW002,Black;Navy;Charcoal,77;82;87;92;97;102;107;112;117;122;127;132;72,all;pants;non taped;syzmik essentials;male;industrial;mix and match;pants and shorts;industrial-workwear;work-pants-and-shorts,Mens Plain Utility Pant,"{'sizes': '72 - 132', 'fabric': '100% Cotton Twill - 280 gsm', 'features': ['280 gsm mid weight pre-shrunk cotton drill to keep you cool while still being tough enough for any job', 'Reinforced double layer heel and pocket patches', 'Wide belt loops', 'Triple stitched seams for extra durability', 'Discrete side welt pocket']}","Sizes: 72 - 132; Fabric: 100% Cotton Twill - 280 gsm; Features: 280 gsm mid weight pre-shrunk cotton drill to keep you cool while still being tough enough for any job,Reinforced double layer heel and pocket patches,Wide belt loops,Triple stitched seams for extra durability,Discrete side welt pocket; ",ZW002_bProduct_Black_01_oyLaXWL.jpg,ZW002_bProduct_Black_01_oyLaXWL.jpg;ZW002_bProduct_Black_02_x2C38I1.jpg;ZW002_bProduct_Navy_01_pHil2DZ.jpg;ZW002_bProduct_Navy_02_6CwCuy4.jpg;ZW002_bProduct_Charcoal_01_rPDpLOT.jpg;ZW002_bProduct_Charcoal_02_IbtOa3v.jpg,normal
ZW004,Black;Navy,72;82;87;92;97;102;107;112;127;132;77;117;122,all;pants;taped;syzmik essentials;male;industrial;pants and shorts;industrial-workwear;work-pants-and-shorts,Mens Taped Utility Pant (Regular),"{'sizes': '72 - 132', 'fabric': '100% Cotton Twill - 280 gsm', 'features': ['280gsm mid weight pre-shrunk cotton drill to keep you cool while still being tough enough for any job', 'Reflective tape', 'Reinforced double layer heel and pocket patches', 'Wide belt loops', 'Triple stitched seams for extra durability', 'Discrete side welt pocket']}","Sizes: 72 - 132; Fabric: 100% Cotton Twill - 280 gsm; Features: 280gsm mid weight pre-shrunk cotton drill to keep you cool while still being tough enough for any job,Reflective tape,Reinforced double layer heel and pocket patches,Wide belt loops,Triple stitched seams for extra durability,Discrete side welt pocket; ",ZW004_bProduct_Black_01_Thv0rC2.jpg,ZW004_bProduct_Black_01_Thv0rC2.jpg;ZW004_bProduct_Black_02_epAt7XI.jpg;ZW004_aTalent_Navy_01_JQ7PLsX.jpg;ZW004_bProduct_Navy_01_bkRNrSZ.jpg;ZW004_bProduct_Navy_02_al9i3Mg.jpg,normal
ZW004S,Navy,87;92;97;102;107;112;117;122;127;132,all;pants;taped;syzmik essentials;male;industrial;pants and shorts;industrial-workwear;work-pants-and-shorts,Mens Taped Utility Pant (Stout),"{'sizes': '87S -132S', 'fabric': '100% Cotton Twill - 280 gsm', 'features': ['280gsm mid weight pre-shrunk cotton drill to keep you cool while still being tough enough for any job', 'Reflective tape', 'Reinforced double layer heel and pocket patches', 'Wide belt loops', 'Triple stitched seams for extra durability', 'Discrete side welt pocket']}","Sizes: 87S -132S; Fabric: 100% Cotton Twill - 280 gsm; Features: 280gsm mid weight pre-shrunk cotton drill to keep you cool while still being tough enough for any job,Reflective tape,Reinforced double layer heel and pocket patches,Wide belt loops,Triple stitched seams for extra durability,Discrete side welt pocket; ",ZW004S_aTalent_Navy_01_QCttncA.jpg,ZW004S_aTalent_Navy_01_QCttncA.jpg;ZW004S_bProduct_Navy_02_3pX84jp.jpg;ZW004S_bProduct_Navy_01_HYHaiz1.jpg,normal
ZW011,Navy;Charcoal;Black,77;82;87;92;97;102;107;112;117;122;127;132;72,all;shorts;syzmik essentials;male;industrial;mix and match;pants and shorts;industrial-workwear;work-pants-and-shorts,Mens Plain Utility Short,"{'sizes': '72 - 132', 'fabric': '100% Cotton Twill - 280 gsm', 'features': ['280 gsm mid weight pre-shrunk cotton drill to keep you cool while still being tough enough for any job', 'Reinforced double layer pocket patches', 'Plastic “D” ring to hold ID or keys', 'Wide belt loops', 'Triple stitched seams for extra durability', 'Discrete side welt']}","Sizes: 72 - 132; Fabric: 100% Cotton Twill - 280 gsm; Features: 280 gsm mid weight pre-shrunk cotton drill to keep you cool while still being tough enough for any job,Reinforced double layer pocket patches,Plastic D ring to hold ID or keys,Wide belt loops,Triple stitched seams for extra durability,Discrete side welt; ",ZW011_bProduct_Navy_01_z7wlIBQ.jpg,ZW011_bProduct_Navy_01_z7wlIBQ.jpg;ZW011_bProduct_Navy_02_MKEcN9c.jpg;ZW011_bProduct_Charcoal_02_3218WPb.jpg;ZW011_bProduct_Charcoal_01_DCbZNXS.jpg;ZW011_bProduct_Black_01_T3mSG4f.jpg;ZW011_bProduct_Black_02_SyTkIlc.jpg,normal
ZW012,Black;Charcoal;Navy,72;77;82;87;92;97;102;112;117;122;127;132;107,all;shorts;syzmik essentials;male;industrial;mix and match;pants and shorts;industrial-workwear;work-pants-and-shorts,Mens Midweight Drill Cargo Short,"{'sizes': '72 - 132', 'fabric': '100% Cotton Twill - 280 gsm', 'features': ['Multi pocket cargo short', '280 gsm mid weight pre-shrunk cotton drill to keep you cool while still being tough enough for any job', 'Inset crotch panel', 'Triple stitched seams for extra durability', 'Wide belt loops', 'Side welt pocket']}","Sizes: 72 - 132; Fabric: 100% Cotton Twill - 280 gsm; Features: Multi pocket cargo short,280 gsm mid weight pre-shrunk cotton drill to keep you cool while still being tough enough for any job,Inset crotch panel,Triple stitched seams for extra durability,Wide belt loops,Side welt pocket; ",ZW012_bProduct_Black_01_q59DyMZ.jpg,ZW012_bProduct_Black_01_q59DyMZ.jpg;ZW012_bProduct_Black_02_FyDozMf.jpg;ZW012_bProduct_Charcoal_02_TtxhuwD.jpg;ZW012_bProduct_Charcoal_01_jRa9j7Z.jpg;ZW012_bProduct_Navy_01_SqypMrQ.jpg;ZW012_bProduct_Navy_02_ASiq0s2.jpg,normal
ZW115,Orange/Navy;Yellow/Navy,2XL;3XL;4XL;5XL;7XL;L;M;S;XL;XS;XXS,all;hi vis non taped;syzmik essentials;male;short sleeve;industrial;shirts and polos;syzmik-shirts,Mens Hi Vis Short Sleeve Shirt,"{'sizes': 'XXS - 5XL, 7XL', 'fabric': '100% Cotton Drill, 150 GSM', 'features': ['Lightweight 150 GSM cotton to keep you cool while you work', ' Under arm and upper back mesh venting', ' Triple stitched seams', ' 2 Chest pockets with button closures and pen partition']}","Sizes: XXS - 5XL, 7XL; Fabric: 100% Cotton Drill, 150 GSM; Features: Lightweight 150 GSM cotton to keep you cool while you work, Under arm and upper back mesh venting, Triple stitched seams, 2 Chest pockets with button closures and pen partition; ",ZW115_aTalent_Orange_Navy_02_YrXwE7R.jpg,ZW115_aTalent_Orange_Navy_02_YrXwE7R.jpg;ZW115_aTalent_Orange_Navy_01_dtJJ2Hx.jpg;ZW115_bProduct_Orange_Navy_02_CYpENHZ.jpg;ZW115_bProduct_Orange_Navy_01_UG5LOja.jpg;ZW115_bProduct_Yellow_Navy_01_dCJNXGy.jpg;ZW115_bProduct_Yellow_Navy_02_en8RSqV.jpg,normal
ZW120,Grey;Sand;Blue;Black,S;M;L;XL;2XL;3XL;4XL;5XL;7XL,shirts;non hi vis;syzmik essentials;male;short sleeve;industrial;shirting and tops;mix and match;shirts and polos;syzmik-shirts,Mens Lightweight Tradie Short Sleeve Shirt,"{'sizes': 'S - 5XL, 7XL', 'fabric': '100% Cotton Twill, 145 GSM', 'features': ['145 GSM Lightweight cotton twill to keep you cool in the hottest environments', ' Triple stitched seams', ' 3 Large chest pockets with pen partition', ' Mobile phone pocket', ' Underarm vent eyelets', ' Extended curve shirt back', ' Centre back yoke pleat']}","Sizes: S - 5XL, 7XL; Fabric: 100% Cotton Twill, 145 GSM; Features: 145 GSM Lightweight cotton twill to keep you cool in the hottest environments, Triple stitched seams, 3 Large chest pockets with pen partition, Mobile phone pocket, Underarm vent eyelets, Extended curve shirt back, Centre back yoke pleat; ",ZW120_aTalent_Grey_01_z2gkr4h.jpg,ZW120_aTalent_Grey_01_z2gkr4h.jpg;ZW120_aTalent_Grey_02_vEhN6aX.jpg;ZW120_bProduct_Grey_01_tvIZXe1.jpg;ZW120_bProduct_Grey_02_Ii6ObjY.jpg;ZW120_bProduct_Sand_01_05R4RhV.jpg;ZW120_bProduct_Sand_02_0pKUiUY.jpg;ZW120_bProduct_Blue_01_8Q5OmKU.jpg;ZW120_bProduct_Blue_02_TIASd3J.jpg;ZW120_bProduct_Black_01_7nCjb0A.jpg;ZW120_bProduct_Black_02_Wf6JjyC.jpg,normal
ZW121,Blue;Black;Grey;Sand,S;M;L;XL;2XL;3XL;4XL;5XL;7XL,all;shirts;non hi vis;syzmik essentials;male;long sleeve;industrial;shirting and tops;mix and match;shirts and polos;syzmik-shirts,Mens Lightweight Tradie Long Sleeve Shirt,"{'sizes': 'S - 5XL, 7XL', 'fabric': '100% Cotton Twill, 145 GSM', 'features': ['145 GSM Lightweight cotton twill to keep you cool in the hottest environments', ' Triple stitched seams', ' 3 Large chest pockets with pen partition', ' Mobile phone pocket', ' Underarm vent eyelets', ' Extended curve shirt back', ' Centre back yoke pleat']}","Sizes: S - 5XL, 7XL; Fabric: 100% Cotton Twill, 145 GSM; Features: 145 GSM Lightweight cotton twill to keep you cool in the hottest environments, Triple stitched seams, 3 Large chest pockets with pen partition, Mobile phone pocket, Underarm vent eyelets, Extended curve shirt back, Centre back yoke pleat; ",ZW121_bProduct_Blue_01_Np1ZfZU.jpg,ZW121_bProduct_Blue_01_Np1ZfZU.jpg;ZW121_bProduct_Blue_02_RnaaqX1.jpg;ZW121_aTalent_Black_01_VGGWE34.jpg;ZW121_bProduct_Black_01_pjO6RKt.jpg;ZW121_bProduct_Black_02_JhD4Xvg.jpg;ZW121_bProduct_Grey_01_qwu6Uk4.jpg;ZW121_bProduct_Grey_02_Q9QLyWR.jpg;ZW121_aTalent_Grey_01_eUw2hFM.jpg;ZW121_aTalent_Sand_01_F8lhvPp.jpg;ZW121_aTalent_Sand_02_mgAzeKA.jpg;ZW121_bProduct_Sand_01_SQzLH7y.jpg;ZW121_bProduct_Sand_02_cPVBoC8.jpg,normal
ZW122,Orange/Navy;Yellow/Navy;Orange/Charcoal;Yellow/Charcoal,S;M;L;XL;2XL;3XL;4XL;5XL;7XL,basic;hi vis non taped;syzmik essentials;male;long sleeve;industrial;shirts and polos;industrial-workwear;work-shirts-and-polos;syzmik-shirts,Mens Industrial Long Sleeve Shirt,"{'sizes': 'S - 5XL, 7XL', 'fabric': '100% Cotton Twill, 170 GSM', 'features': ['170 GSM Midweight cotton twill to keep you cool while still being tough enough for any job', ' Underarm and upper back mesh vent inserts', ' Triple stitched seams', ' 2 Chest pockets with button closures and pen partition', ' Extended curve shirt back']}","Sizes: S - 5XL, 7XL; Fabric: 100% Cotton Twill, 170 GSM; Features: 170 GSM Midweight cotton twill to keep you cool while still being tough enough for any job, Underarm and upper back mesh vent inserts, Triple stitched seams, 2 Chest pockets with button closures and pen partition, Extended curve shirt back; ",ZW122_bProduct_Orange_Navy_01_j8vD11G.jpg,ZW122_bProduct_Orange_Navy_01_j8vD11G.jpg;ZW122_bProduct_Orange_Navy_02_HIA5VGm.jpg;ZW122_bProduct_Yellow_Navy_01_Ppp1KpW.jpg;ZW122_bProduct_Yellow_Navy_02_JmfEJn2.jpg;ZW122_bProduct_Orange_Charcoal_01_IDWBncs.jpg;ZW122_bProduct_Orange_Charcoal_02_01vTyBB.jpg;ZW122_bProduct_Yellow_Charcoal_02_WV799Ie.jpg;ZW122_bProduct_Yellow_Charcoal_01_tq8pObL.jpg,normal
ZW123,Orange/Black;Yellow/Black;Orange/Charcoal;Yellow/Charcoal;Orange/Navy;Yellow/Navy,S;M;L;XL;2XL;3XL;4XL;5XL;7XL,all;hi vis taped;syzmik essentials;male;long sleeve;industrial;shirts and polos;industrial-workwear;work-shirts-and-polos;syzmik-shirts,Mens Industrial Long Sleeve Shirt - Hoop Taped,"{'sizes': 'S - 5XL, 7XL', 'fabric': '100% Cotton Twill, 170 GSM', 'features': ['170 GSM Midweight cotton twill to keep you cool while still being tough enough for any job', ' Underarm and upper back mesh vent inserts', ' Triple stitched seams', ' Reflective tape in hoop configuration', ' 2 Chest pockets with button closures and pen partition', ' Extended curve shirt back']}","Sizes: S - 5XL, 7XL; Fabric: 100% Cotton Twill, 170 GSM; Features: 170 GSM Midweight cotton twill to keep you cool while still being tough enough for any job, Underarm and upper back mesh vent inserts, Triple stitched seams, Reflective tape in hoop configuration, 2 Chest pockets with button closures and pen partition, Extended curve shirt back; ",ZW123_Product_Orange_Black_01.jpg,ZW123_Product_Orange_Black_01.jpg;ZW123_Product_Orange_Black_02.jpg;ZW123_aTalent_Yellow_Black_01_uIxviZf.jpg;ZW123_Product_Yellow_Black_02.jpg;ZW123_Product_Yellow_Black_01.jpg;ZW123_Product_Orange_Charcoal_01.jpg;ZW123_Product_Orange_Charcoal_02.jpg;ZW123_Product_Yellow_Charcoal_01.jpg;ZW123_Product_Yellow_Charcoal_02.jpg;ZW123_Product_Orange_Navy_01.jpg;ZW123_Product_Orange_Navy_02.jpg;ZW123_aTalent_Yellow_Navy_01_PJ9JRV5.jpg;ZW123_Product_Yellow_Navy_02.jpg;ZW123_Product_Yellow_Navy_01.jpg,normal
ZW124,Yellow/Navy;Orange/Navy,S;L;XL;2XL;3XL;4XL;5XL;7XL;M,hi vis taped;syzmik essentials;male;long sleeve;industrial;shirts and polos;industrial-workwear;work-shirts-and-polos;syzmik-shirts,Mens Industrial Long Sleeve Shirt - Shoulder Taped,"{'sizes': 'S - 5XL, 7XL', 'fabric': '100% Cotton Twill, 170 GSM', 'features': ['170 GSM Midweight cotton twill to keep you cool while still being tough enough for any job', ' Underarm and upper back mesh vent inserts', ' Triple stitched seams', ' Reflective tape in H configuration', ' 2 Chest pockets with button closures and pen partition', ' Extended curve shirt back']}","Sizes: S - 5XL, 7XL; Fabric: 100% Cotton Twill, 170 GSM; Features: 170 GSM Midweight cotton twill to keep you cool while still being tough enough for any job, Underarm and upper back mesh vent inserts, Triple stitched seams, Reflective tape in H configuration, 2 Chest pockets with button closures and pen partition, Extended curve shirt back; ",ZW124_Product_Yellow_Navy_01_jDlzAUH.jpg,ZW124_Product_Yellow_Navy_01_jDlzAUH.jpg;ZW124_Product_Yellow_Navy_02.jpg;ZW124_Product_Orange_Navy_01.jpg;ZW124_Product_Orange_Navy_02.jpg,normal
ZW128,Yellow/Navy;Orange/Charcoal;Orange/Navy;Yellow/Charcoal,XXS;S;M;L;XL;2XL;3XL;4XL;5XL;7XL;XS,all;hi vis non taped;rugged cooling;male;long sleeve;industrial;shirts and polos;industrial-workwear;work-shirts-and-polos;syzmik-shirts,Mens Rugged Cooling Hi Vis Long Sleeve Shirt,"{'sizes': 'XXS - 5XL, 7XL', 'fabric': '100% Square Weave Cotton Ripstop, 145 GSM', 'features': ['Mesh venting to increase breathability in the under arm, upper back, and back side seam', ' Mechanical stretch to give you more freedom of movement', ' 2 Chest pockets with pen partition', ' Reinforced at all key stress points with bar tacks', ' Modern fit']}","Sizes: XXS - 5XL, 7XL; Fabric: 100% Square Weave Cotton Ripstop, 145 GSM; Features: Mesh venting to increase breathability in the under arm, upper back, and back side seam, Mechanical stretch to give you more freedom of movement, 2 Chest pockets with pen partition, Reinforced at all key stress points with bar tacks, Modern fit; ",ZW128_bProduct_Yellow_Navy_01_SQ7TLGT.jpg,ZW128_bProduct_Yellow_Navy_01_SQ7TLGT.jpg;ZW128_bProduct_Yellow_Navy_02_oBhfJEL.jpg;ZW128_bProduct_Orange_Charcoal_01_GGhRg4j.jpg;ZW128_bProduct_Orange_Charcoal_02_su0Dtl8.jpg;ZW128_bProduct_Orange_Navy_01_ja2OsaR.jpg;ZW128_bProduct_Orange_Navy_02_jKp04H2.jpg;ZW128_bProduct_Yellow_Charcoal_01_PMuutSz.jpg;ZW128_bProduct_Yellow_Charcoal_02_vKBI8Hs.jpg,normal
